{
  "image_id": "FIXTURE_SCREENSHOT_0001",
  "source_group_id": "SYNTHETIC_GROUP_0001",
  "parent_image_id": null,
  "provenance": "synthetic_template",
  "participant_id_hash": null,
  "provider_family": "GENERIC_MOMO",
  "template_family": "GENERIC_V1",
  "template_version": "synthetic-1",
  "capture_channel": "sms",
  "device_family": "synthetic-canvas",
  "os_family": "other",
  "resolution": [640, 900],
  "theme": "light",
  "image_class": "unaltered",
  "tamper_target": "none",
  "tamper_method": "none",
  "benign_transform": "none",
  "mask_path": null,
  "transcript_path": "fixtures/ocr-truth.fixture.json",
  "ground_truth_fields_path": "fixtures/ocr-truth.fixture.json",
  "split": "train",
  "consent_scope": "synthetic_not_applicable",
  "permission_reference": "SYNTHETIC_FIXTURE_POLICY_V1",
  "sha256": "1111111111111111111111111111111111111111111111111111111111111111"
}
